[
  {
    "customer_id": "C00000001",
    "campaign_id": "CMP2024_QR01",
    "tenure_days": 162,
    "age_band": "25-34",
    "region_code": "KHU",
    "kyc_level": "verified",
    "acquisition_channel": "app",
    "txn_count_30d": 14,
    "txn_count_90d": 39,
    "txn_amount_30d_bdt": 12936.5,
    "txn_amount_90d_bdt": 49955.09,
    "qr_txn_share_90d": 0.1282,
    "cashout_share_90d": 0.1026,
    "merchant_pay_share_90d": 0.1282,
    "days_since_last_txn": 7,
    "avg_ticket_90d_bdt": 1280.9,
    "app_channel_share_90d": 0.7692,
    "campaign_exposures_prior_30d": 1,
    "campaign_exposures_prior_90d": 2,
    "days_since_last_campaign": 26,
    "objective": "qr_adoption",
    "offer_type": "flat_cashback",
    "incentive_value": 20.0,
    "incentive_cost_bdt": 20.0,
    "treatment": 1,
    "y_transacted": 1
  },
  {
    "customer_id": "C00000004",
    "campaign_id": "CMP2024_QR01",
    "tenure_days": 165,
    "age_band": "18-24",
    "region_code": "CTG",
    "kyc_level": "verified",
    "acquisition_channel": "app",
    "txn_count_30d": 15,
    "txn_count_90d": 34,
    "txn_amount_30d_bdt": 10372.4,
    "txn_amount_90d_bdt": 21288.99,
    "qr_txn_share_90d": 0.1176,
    "cashout_share_90d": 0.2353,
    "merchant_pay_share_90d": 0.0882,
    "days_since_last_txn": 7,
    "avg_ticket_90d_bdt": 626.15,
    "app_channel_share_90d": 0.7941,
    "campaign_exposures_prior_30d": 0,
    "campaign_exposures_prior_90d": 1,
    "days_since_last_campaign": 87,
    "objective": "qr_adoption",
    "offer_type": "flat_cashback",
    "incentive_value": 20.0,
    "incentive_cost_bdt": 20.0,
    "treatment": 0,
    "y_transacted": 0
  },
  {
    "customer_id": "C00000005",
    "campaign_id": "CMP2024_QR01",
    "tenure_days": 447,
    "age_band": "25-34",
    "region_code": "RAJ",
    "kyc_level": "verified",
    "acquisition_channel": "referral",
    "txn_count_30d": 18,
    "txn_count_90d": 40,
    "txn_amount_30d_bdt": 19505.39,
    "txn_amount_90d_bdt": 46184.69,
    "qr_txn_share_90d": 0.2,
    "cashout_share_90d": 0.1,
    "merchant_pay_share_90d": 0.1,
    "days_since_last_txn": 3,
    "avg_ticket_90d_bdt": 1154.62,
    "app_channel_share_90d": 0.725,
    "campaign_exposures_prior_30d": 0,
    "campaign_exposures_prior_90d": 1,
    "days_since_last_campaign": 39,
    "objective": "qr_adoption",
    "offer_type": "flat_cashback",
    "incentive_value": 20.0,
    "incentive_cost_bdt": 20.0,
    "treatment": 1,
    "y_transacted": 1
  },
  {
    "customer_id": "C00000006",
    "campaign_id": "CMP2024_QR01",
    "tenure_days": 534,
    "age_band": "18-24",
    "region_code": "DHK",
    "kyc_level": "verified",
    "acquisition_channel": "app",
    "txn_count_30d": 8,
    "txn_count_90d": 25,
    "txn_amount_30d_bdt": 8907.2,
    "txn_amount_90d_bdt": 28352.76,
    "qr_txn_share_90d": 0.16,
    "cashout_share_90d": 0.24,
    "merchant_pay_share_90d": 0.08,
    "days_since_last_txn": 4,
    "avg_ticket_90d_bdt": 1134.11,
    "app_channel_share_90d": 0.72,
    "campaign_exposures_prior_30d": 0,
    "campaign_exposures_prior_90d": 1,
    "days_since_last_campaign": 61,
    "objective": "qr_adoption",
    "offer_type": "flat_cashback",
    "incentive_value": 20.0,
    "incentive_cost_bdt": 20.0,
    "treatment": 0,
    "y_transacted": 1
  },
  {
    "customer_id": "C00000008",
    "campaign_id": "CMP2024_QR01",
    "tenure_days": 6,
    "age_band": "35-44",
    "region_code": "DHK",
    "kyc_level": "verified",
    "acquisition_channel": "referral",
    "txn_count_30d": 2,
    "txn_count_90d": 2,
    "txn_amount_30d_bdt": 740.63,
    "txn_amount_90d_bdt": 740.63,
    "qr_txn_share_90d": 0.0,
    "cashout_share_90d": 0.0,
    "merchant_pay_share_90d": 0.0,
    "days_since_last_txn": 1,
    "avg_ticket_90d_bdt": 370.31,
    "app_channel_share_90d": 0.5,
    "campaign_exposures_prior_30d": 0,
    "campaign_exposures_prior_90d": 0,
    "days_since_last_campaign": 999,
    "objective": "qr_adoption",
    "offer_type": "flat_cashback",
    "incentive_value": 20.0,
    "incentive_cost_bdt": 20.0,
    "treatment": 1,
    "y_transacted": 0
  },
  {
    "customer_id": "C00000010",
    "campaign_id": "CMP2024_QR01",
    "tenure_days": 641,
    "age_band": "25-34",
    "region_code": "CTG",
    "kyc_level": "verified",
    "acquisition_channel": "agent",
    "txn_count_30d": 11,
    "txn_count_90d": 26,
    "txn_amount_30d_bdt": 13469.33,
    "txn_amount_90d_bdt": 27854.54,
    "qr_txn_share_90d": 0.1923,
    "cashout_share_90d": 0.1154,
    "merchant_pay_share_90d": 0.0769,
    "days_since_last_txn": 2,
    "avg_ticket_90d_bdt": 1071.33,
    "app_channel_share_90d": 0.7692,
    "campaign_exposures_prior_30d": 0,
    "campaign_exposures_prior_90d": 2,
    "days_since_last_campaign": 35,
    "objective": "qr_adoption",
    "offer_type": "flat_cashback",
    "incentive_value": 20.0,
    "incentive_cost_bdt": 20.0,
    "treatment": 1,
    "y_transacted": 1
  },
  {
    "customer_id": "C00000011",
    "campaign_id": "CMP2024_QR01",
    "tenure_days": 289,
    "age_band": "25-34",
    "region_code": "CTG",
    "kyc_level": "verified",
    "acquisition_channel": "agent",
    "txn_count_30d": 10,
    "txn_count_90d": 26,
    "txn_amount_30d_bdt": 8892.83,
    "txn_amount_90d_bdt": 14707.46,
    "qr_txn_share_90d": 0.1923,
    "cashout_share_90d": 0.1538,
    "merchant_pay_share_90d": 0.0769,
    "days_since_last_txn": 4,
    "avg_ticket_90d_bdt": 565.67,
    "app_channel_share_90d": 0.6538,
    "campaign_exposures_prior_30d": 0,
    "campaign_exposures_prior_90d": 1,
    "days_since_last_campaign": 44,
    "objective": "qr_adoption",
    "offer_type": "flat_cashback",
    "incentive_value": 20.0,
    "incentive_cost_bdt": 20.0,
    "treatment": 1,
    "y_transacted": 1
  },
  {
    "customer_id": "C00000013",
    "campaign_id": "CMP2024_QR01",
    "tenure_days": 9,
    "age_band": "35-44",
    "region_code": "RAJ",
    "kyc_level": "verified",
    "acquisition_channel": "app",
    "txn_count_30d": 1,
    "txn_count_90d": 1,
    "txn_amount_30d_bdt": 4457.98,
    "txn_amount_90d_bdt": 4457.98,
    "qr_txn_share_90d": 0.0,
    "cashout_share_90d": 0.0,
    "merchant_pay_share_90d": 0.0,
    "days_since_last_txn": 5,
    "avg_ticket_90d_bdt": 4457.98,
    "app_channel_share_90d": 1.0,
    "campaign_exposures_prior_30d": 0,
    "campaign_exposures_prior_90d": 0,
    "days_since_last_campaign": 999,
    "objective": "qr_adoption",
    "offer_type": "flat_cashback",
    "incentive_value": 20.0,
    "incentive_cost_bdt": 20.0,
    "treatment": 0,
    "y_transacted": 1
  },
  {
    "customer_id": "C00000014",
    "campaign_id": "CMP2024_QR01",
    "tenure_days": 607,
    "age_band": "25-34",
    "region_code": "SYL",
    "kyc_level": "verified",
    "acquisition_channel": "referral",
    "txn_count_30d": 2,
    "txn_count_90d": 9,
    "txn_amount_30d_bdt": 1927.74,
    "txn_amount_90d_bdt": 7834.72,
    "qr_txn_share_90d": 0.1111,
    "cashout_share_90d": 0.2222,
    "merchant_pay_share_90d": 0.0,
    "days_since_last_txn": 19,
    "avg_ticket_90d_bdt": 870.52,
    "app_channel_share_90d": 0.2222,
    "campaign_exposures_prior_30d": 0,
    "campaign_exposures_prior_90d": 2,
    "days_since_last_campaign": 62,
    "objective": "qr_adoption",
    "offer_type": "flat_cashback",
    "incentive_value": 20.0,
    "incentive_cost_bdt": 20.0,
    "treatment": 1,
    "y_transacted": 0
  },
  {
    "customer_id": "C00000015",
    "campaign_id": "CMP2024_QR01",
    "tenure_days": 227,
    "age_band": "35-44",
    "region_code": "DHK",
    "kyc_level": "limited",
    "acquisition_channel": "referral",
    "txn_count_30d": 2,
    "txn_count_90d": 6,
    "txn_amount_30d_bdt": 2454.96,
    "txn_amount_90d_bdt": 15662.47,
    "qr_txn_share_90d": 0.0,
    "cashout_share_90d": 0.1667,
    "merchant_pay_share_90d": 0.1667,
    "days_since_last_txn": 14,
    "avg_ticket_90d_bdt": 2610.41,
    "app_channel_share_90d": 0.5,
    "campaign_exposures_prior_30d": 0,
    "campaign_exposures_prior_90d": 1,
    "days_since_last_campaign": 69,
    "objective": "qr_adoption",
    "offer_type": "flat_cashback",
    "incentive_value": 20.0,
    "incentive_cost_bdt": 20.0,
    "treatment": 1,
    "y_transacted": 0
  },
  {
    "customer_id": "C00000017",
    "campaign_id": "CMP2024_QR01",
    "tenure_days": 474,
    "age_band": "18-24",
    "region_code": "CTG",
    "kyc_level": "limited",
    "acquisition_channel": "referral",
    "txn_count_30d": 1,
    "txn_count_90d": 6,
    "txn_amount_30d_bdt": 569.92,
    "txn_amount_90d_bdt": 5795.12,
    "qr_txn_share_90d": 0.1667,
    "cashout_share_90d": 0.3333,
    "merchant_pay_share_90d": 0.1667,
    "days_since_last_txn": 25,
    "avg_ticket_90d_bdt": 965.85,
    "app_channel_share_90d": 0.5,
    "campaign_exposures_prior_30d": 0,
    "campaign_exposures_prior_90d": 2,
    "days_since_last_campaign": 50,
    "objective": "qr_adoption",
    "offer_type": "flat_cashback",
    "incentive_value": 20.0,
    "incentive_cost_bdt": 20.0,
    "treatment": 1,
    "y_transacted": 1
  },
  {
    "customer_id": "C00000019",
    "campaign_id": "CMP2024_QR01",
    "tenure_days": 431,
    "age_band": "18-24",
    "region_code": "CTG",
    "kyc_level": "verified",
    "acquisition_channel": "agent",
    "txn_count_30d": 0,
    "txn_count_90d": 7,
    "txn_amount_30d_bdt": 0,
    "txn_amount_90d_bdt": 5190.75,
    "qr_txn_share_90d": 0.1429,
    "cashout_share_90d": 0.0,
    "merchant_pay_share_90d": 0.1429,
    "days_since_last_txn": 31,
    "avg_ticket_90d_bdt": 741.54,
    "app_channel_share_90d": 0.2857,
    "campaign_exposures_prior_30d": 0,
    "campaign_exposures_prior_90d": 1,
    "days_since_last_campaign": 37,
    "objective": "qr_adoption",
    "offer_type": "flat_cashback",
    "incentive_value": 20.0,
    "incentive_cost_bdt": 20.0,
    "treatment": 0,
    "y_transacted": 1
  },
  {
    "customer_id": "C00000020",
    "campaign_id": "CMP2024_QR01",
    "tenure_days": 322,
    "age_band": "45-54",
    "region_code": "CTG",